{
  "id": "bedra-kurinye-po-koreyski",
  "title": "Бёдра куриные по-корейски",
  "description": "Сочные, ароматные бёдра с хрустящей корочкой в сладко-остром маринаде терияки. Готовятся быстро и просто, а результат — как в любимом корейском кафе!",
  "category": "goryachee",
  "tags": ["с курицей", "азиатское"],
  "servings": {"qty": 2, "unit": "порции"},
  "time": {"text": "~15 минут", "note": "+ время на маринование по желанию", "minutes": 15},
  "ingredients": [
    {
      "group": null,
      "items": [
        {"name": "Филе бёдра куриное", "key": "курица", "qty": [5, 6], "unit": "шт."},
        {"name": "Крахмал кукурузный", "key": "крахмал", "amount": "для обваливания"},
        {"name": "Масло сливочное/топлёное", "key": "сливочное масло", "qty": 20, "unit": "г"},
        {"name": "Соус терияки", "key": "соус терияки", "qty": [50, 70], "unit": "мл"},
        {"name": "Паприка", "key": "паприка", "qty": 0.5, "unit": "ч. л."},
        {"name": "Чили", "key": "острый перец", "amount": "по вкусу"},
        {"name": "Чеснок", "key": "чеснок", "qty": 2, "unit": "зубчик"},
        {"name": "Соль, перец", "key": "соль", "amount": "по вкусу"},
        {"name": "Лук зелёный + кунжут", "key": "зелёный лук", "amount": "для подачи"}
      ]
    }
  ],
  "steps": [
    {"text": "Филе бёдра отделяем от костей и нарезаем на небольшие кусочки."},
    {"text": "Бёдрышки солим, перчим и обваливаем в крахмале с двух сторон."},
    {"text": "Обжариваем филе на сливочном (или топлёном) масле с двух сторон до румяной корочки."},
    {"text": "Убираем филе из сковороды."},
    {"text": "Добавляем соус терияки и прогреваем 1–2 минуты, помешивая, до лёгкого загустения соуса."},
    {"text": "В эту же сковороду возвращаем филе."},
    {"text": "Снимаем с огня. По желанию можно дать постоять 10–15 минут, чтобы вкус стал ярче."},
    {"text": "Подаём с рисом, посыпав зелёным луком и кунжутом. Приятного аппетита!"}
  ],
  "tips": [],
  "card": {"image": "cards/bedra-kurinye-po-koreyski.jpg", "theme": "plum"},
  "photo": "photos/bedra-kurinye-po-koreyski.jpg",
  "author": "Юля",
  "added": "2026-10-16"
}
