{
  "id": "lazanya",
  "title": "Лазанья",
  "description": "Сочная, ароматная лазанья с мясным соусом и нежным бешамелем, запечённая до румяной корочки.",
  "category": "goryachee",
  "tags": ["с мясом", "запеканка", "итальянское"],
  "servings": {"qty": 6, "unit": "порций"},
  "time": {"text": "~1 ч 30 мин", "minutes": 90},
  "equipment": "Духовка 180 °C",
  "ingredients": [
    {
      "group": null,
      "items": [
        {"name": "Листы лазаньи", "key": "лазанья", "qty": 15, "unit": "шт."},
        {"name": "Говядина/телятина", "key": "говядина", "qty": 600, "unit": "г"},
        {"name": "Морковь", "key": "морковь", "qty": 1, "unit": "шт."},
        {"name": "Лук", "key": "лук", "qty": 1, "unit": "шт."},
        {"name": "Чеснок", "key": "чеснок", "qty": 2, "unit": "зубчик"},
        {"name": "Белое вино", "key": "вино", "qty": 50, "unit": "мл"},
        {"name": "Томаты протёртые", "key": "помидоры", "qty": 400, "unit": "г"},
        {"name": "Томатный сок", "key": "томатный сок", "qty": 200, "unit": "мл"},
        {"name": "Цедра апельсина + лимона", "key": "лимон", "qty": 1, "unit": "ч. л."},
        {"name": "Сахар", "key": "сахар", "qty": 1, "unit": "ч. л."},
        {"name": "Итальянские травы", "key": "итальянские травы", "qty": 0.5, "unit": "ч. л."},
        {"name": "Базилик", "key": "базилик", "qty": [5, 6], "unit": "листьев"},
        {"name": "Моцарелла", "key": "моцарелла", "qty": 250, "unit": "г"},
        {"name": "Пармезан", "key": "пармезан", "qty": 40, "unit": "г"}
      ]
    },
    {
      "group": "Для соуса Бешамель",
      "items": [
        {"name": "Сливочное масло", "key": "сливочное масло", "qty": 40, "unit": "г"},
        {"name": "Мука", "key": "мука", "qty": 40, "unit": "г"},
        {"name": "Молоко", "key": "молоко", "qty": 500, "unit": "мл"},
        {"name": "Мускатный орех", "key": "мускатный орех", "amount": "щепотка"},
        {"name": "Соль, перец", "key": "соль", "amount": "по вкусу"}
      ]
    }
  ],
  "steps": [
    {"text": "Морковь и лук нарезать мелким кубиком, мясо прокрутить. В сковороде обжарить морковь, затем добавить лук и довести до золотистости. Добавить фарш, обжарить до изменения цвета и выпаривания сока. Влить вино, выпарить алкоголь, затем добавить томаты и сок. Добавить цедру, чеснок, соль, специи, базилик. Тушить под крышкой ~1–1,5 часа на слабом огне."},
    {"title": "Бешамель", "text": "Растопить масло, добавить муку, прогреть 1–2 минуты. Влить молоко комнатной температуры, постоянно мешая. Довести до загустения, добавить соль, перец и мускатный орех."},
    {"title": "Собрать лазанью", "text": "Форма → мясной соус → сухие листы лазаньи → бешамель → сыр. Повторить слои. Верх: листы + бешамель + моцарелла + пармезан."},
    {"text": "Накрыть фольгой и запекать при 180 °C ~30 минут. Снять фольгу и допечь ещё ~20 минут до румяной корочки."},
    {"text": "Дать постоять 15–20 минут перед подачей."}
  ],
  "tips": [],
  "notes": [
    {
      "title": "Советы",
      "items": [
        "Лучше всего держит форму на следующий день — после ночи в холодильнике лазанья становится плотнее и режется идеально.",
        "Дай постоять после духовки 15–20 минут — так она не развалится при нарезке."
      ]
    },
    {
      "title": "Важно",
      "items": [
        "Лазанье нужно время, чтобы «отдохнуть» — не спешите нарезать сразу из духовки. Так получится идеально."
      ]
    }
  ],
  "card": {"image": "cards/lazanya.jpg", "theme": "green"},
  "photo": "photos/lazanya.jpg",
  "author": "Юля",
  "added": "2026-10-16"
}
