{
  "id": "marinovannye-percy",
  "title": "Маринованные перцы",
  "description": "Яркие, ароматные и очень вкусные маринованные перцы! Идеальны для тостов, салатов, закусок и просто так.",
  "category": "zakuski",
  "tags": ["овощи", "заготовки"],
  "servings": {"qty": 2, "unit": "порции"},
  "time": {"text": "~1 ч 10 мин", "note": "+ ночь в холодильнике", "minutes": 70},
  "equipment": "Духовка 200 °C",
  "ingredients": [
    {
      "group": null,
      "items": [
        {"name": "Болгарский перец", "note": "больших", "key": "болгарский перец", "qty": 2, "unit": "шт."},
        {"name": "Винный уксус", "key": "уксус", "qty": 1, "unit": "ч. л."},
        {"name": "Соль", "key": "соль", "amount": "по вкусу"},
        {"name": "Перец чёрный", "key": "чёрный перец", "amount": "по вкусу"},
        {"name": "Сушёный чеснок", "key": "чеснок", "qty": 0.5, "unit": "ч. л."},
        {"name": "Оливковое масло", "key": "оливковое масло", "qty": [1, 2], "unit": "ст. л."}
      ]
    }
  ],
  "steps": [
    {"text": "Духовку разогрейте до 200 °C."},
    {"text": "Перцы запеките на противне до чёрной кожицы со всех сторон, примерно 40 минут. Периодически переворачивайте."},
    {"text": "Готовые перцы переложите в целлофановый пакет и плотно завяжите. Оставьте до полного остывания — так кожица снимется легко."},
    {"text": "Снимите кожицу, удалите семена и нарежьте перцы полосками."},
    {"text": "В миске смешайте перцы с винным уксусом, солью, перцем, сушёным чесноком и оливковым маслом. Хорошо перемешайте."},
    {"text": "Переложите в контейнер с крышкой и уберите в холодильник на ночь."}
  ],
  "tips": [
    "Такие перцы становятся ещё вкуснее на второй день! Храните в холодильнике до 4–5 дней в закрытой ёмкости."
  ],
  "notes": [
    {
      "title": "Подача",
      "items": [
        "Утром выложите перцы на поджаренный тост с брынзой или творожным сыром. Это божественно вкусно!"
      ]
    }
  ],
  "card": {"image": "cards/marinovannye-percy.jpg", "theme": "plum"},
  "photo": "photos/marinovannye-percy.jpg",
  "author": "Юля",
  "added": "2026-10-16"
}
