{
  "id": "samye-pyshnye-oladushki",
  "title": "Самые пышные оладушки",
  "description": "Нежные, воздушные и очень вкусные оладьи на кефире. Идеально на завтрак или перекус.",
  "category": "zavtraki",
  "tags": ["сладкое", "быстро"],
  "servings": {"qty": [3, 4], "unit": "порции"},
  "time": {"text": "~20 минут", "minutes": 20},
  "ingredients": [
    {
      "group": null,
      "items": [
        {"name": "Кефир 2,5% или 3,2%", "key": "кефир", "qty": 300, "unit": "мл"},
        {"name": "Сода", "key": "сода", "qty": 0.5, "unit": "ч. л."},
        {"name": "Сахар", "key": "сахар", "qty": 1, "unit": "ст. л."},
        {"name": "Соль", "key": "соль", "amount": "щепотка"},
        {"name": "Мука", "key": "мука", "qty": 180, "unit": "г"},
        {"name": "Масло для жарки", "key": "растительное масло", "amount": "для жарки"}
      ]
    }
  ],
  "steps": [
    {"text": "Влить кефир в миску и добавить соду. Перемешать и оставить на 2–3 минуты, пока сода погасится и появится пена."},
    {"text": "Добавить сахар и соль, перемешать ложкой. Не миксером!"},
    {"text": "Постепенно всыпать муку и перемешивать ложкой до однородного состояния без комочков. Долго мешать не стоит, чтобы тесто не потеряло пышность."},
    {"text": "Разогреть сковороду с маслом."},
    {"text": "Выкладывать тесто ложкой."},
    {"text": "Жарить оладьи с двух сторон на среднем огне до золотистой корочки. (Я жарю на 6 из 9.)"},
    {"text": "Готовые оладьи выкладывать на бумажное полотенце."},
    {"text": "Подавать с любимым соусом или сметаной. Они должны получиться очень вкусными!"}
  ],
  "tips": [],
  "notes": [
    {
      "title": "Заметки",
      "items": [
        "Не гасить соду уксусом!",
        "Лучше жарить на среднем огне.",
        "Подавать со сметаной, вареньем или мёдом.",
        "Тесто не должно быть слишком густым."
      ]
    }
  ],
  "card": {"image": "cards/samye-pyshnye-oladushki.jpg", "theme": "terracotta"},
  "photo": "photos/samye-pyshnye-oladushki.jpg",
  "author": "Юля",
  "added": "2026-10-16"
}
