{
  "id": "pshennaya-kasha-s-yablokom",
  "title": "Пшённая каша с запечённым яблоком",
  "description": "Нежная, кремовая каша с ароматным запечённым яблоком и карамельной корицей. Как в кафе, только ещё вкуснее!",
  "category": "zavtraki",
  "tags": ["сладкое"],
  "servings": { "qty": [1, 2], "unit": "порции" },
  "time": { "text": "35–45 минут", "minutes": [35, 45] },
  "difficulty": "средняя",
  "ingredients": [
    {
      "group": "Пшённая каша",
      "items": [
        { "name": "Пшено", "note": "в сухом виде", "key": "пшено", "qty": 60, "unit": "г" },
        { "name": "Вода", "key": "вода", "qty": 160, "unit": "мл" },
        { "name": "Молоко", "key": "молоко", "qty": [250, 300], "unit": "мл" },
        { "name": "Сахар", "key": "сахар", "qty": [1, 2], "unit": "ч. л." },
        { "name": "Соль", "key": "соль", "amount": "щепотка" },
        { "name": "Сливочное масло", "key": "сливочное масло", "qty": 10, "unit": "г" }
      ]
    },
    {
      "group": "Запечённое яблоко",
      "items": [
        { "name": "Яблоко крупное", "note": "или 2 маленьких", "key": "яблоко", "qty": 1, "unit": "шт." },
        { "name": "Сливочное масло", "key": "сливочное масло", "qty": [5, 10], "unit": "г" },
        { "name": "Сахар коричневый", "key": "сахар", "qty": 1, "unit": "ч. л." },
        { "name": "Корица", "key": "корица", "amount": "по вкусу" },
        { "name": "Вода", "note": "на дно формы", "key": "вода", "qty": [30, 40], "unit": "мл" }
      ]
    },
    {
      "group": "Карамельный соус (по желанию)",
      "items": [
        { "name": "Сахар", "key": "сахар", "qty": 2, "unit": "ст. л." },
        { "name": "Вода", "key": "вода", "qty": 2, "unit": "ст. л." },
        { "name": "Сливочное масло", "key": "сливочное масло", "qty": 20, "unit": "г" },
        { "name": "Сливки 20%", "key": "сливки", "qty": 30, "unit": "мл" },
        { "name": "Соль", "key": "соль", "amount": "щепотка" }
      ]
    }
  ],
  "steps": [
    { "title": "Запечь яблоко", "text": "Яблоко очистить от кожуры, удалить сердцевину. Положить в форму, в середину — кусочек сливочного масла, сахар и немного корицы. Добавить на дно формы 30–40 мл воды, накрыть крышкой или фольгой. Запекать при 190 °C 25 минут, затем снять крышку и запекать ещё 5–10 минут, до мягкости. Яблоко должно стать очень мягким." },
    { "title": "Подготовить пшено", "text": "Пшено хорошо промыть 3–4 раза тёплой водой. Залить кипятком на 1–2 минуты, затем слить." },
    { "title": "Сварить кашу", "text": "Залить пшено 160 мл свежей воды, довести до кипения и варить на небольшом огне 8–10 минут, пока вода почти не впитается. Влить тёплое молоко, добавить сахар и соль. Варить на слабом огне 15–20 минут, периодически помешивая, до мягкости и кремовой консистенции. Выключить, добавить масло и оставить под крышкой на 10 минут." },
    { "title": "Приготовить карамель (по желанию)", "text": "В сотейнике растопить сахар до янтарного цвета, добавить воду (осторожно!), затем сливочное масло и сливки. Варить 1–2 минуты до гладкости. Добавить щепотку соли." },
    { "title": "Собрать блюдо", "text": "Выложить горячую пшённую кашу в тарелку, сверху — запечённое яблоко. Полить карамельным соусом, по желанию посыпать корицей." }
  ],
  "tips": [
    "Яблоко лучше брать сладкое и плотное (Гала, Фуджи, Голден).",
    "Кашу можно сделать чуть жиже или гуще по вкусу.",
    "Вместо карамели можно добавить мёд или орехи."
  ],
  "card": {
    "image": "cards/pshennaya-kasha-s-yablokom.jpg",
    "theme": "green",
    "sticker": "Ароматно, по-домашнему и очень вкусно!",
    "aside": "Ароматная карамель — идеальное дополнение!"
  },
  "photo": "photos/pshennaya-kasha-s-yablokom.jpg",
  "author": "Юля",
  "added": "2026-10-15"
}
