{
  "id": "shashlyk-iz-svinoy-shei",
  "title": "Шашлык из свиной шеи",
  "description": "Шея — идеальный отруб для шашлыка: сочетание мяса и тонких жировых прослоек делает его особенно сочным, мягким и ароматным. Главное — не пересушить. Правильный маринад и немного времени — и шашлык буквально тает во рту!",
  "category": "goryachee",
  "tags": ["с мясом", "на гриле", "шашлык"],
  "servings": {"qty": 1000, "unit": "г", "note": "выход готового блюда"},
  "time": {"text": "Шашлык на мангале 20–25 минут", "note": "+ ночь маринования", "minutes": [20, 25]},
  "ingredients": [
    {
      "group": null,
      "items": [
        {"name": "Свинина шея", "key": "свинина", "qty": 1000, "unit": "г"},
        {"name": "Репчатый лук", "key": "лук", "qty": 100, "unit": "г"},
        {"name": "Хмели-сунели", "key": "хмели-сунели", "qty": 6, "unit": "г"},
        {"name": "Газированная вода", "key": "газированная вода", "qty": 100, "unit": "г"},
        {"name": "Масло растительное", "key": "растительное масло", "qty": 30, "unit": "г"},
        {"name": "Соль", "key": "соль", "qty": 10, "unit": "г"},
        {"name": "Чёрный перец свежемолотый", "key": "чёрный перец", "qty": 3, "unit": "г"}
      ]
    }
  ],
  "steps": [
    {"text": "Нарежьте свиную шею ровными кусочками среднего размера (около 4–5 см)."},
    {"text": "Репчатый лук нарежьте полукольцами и обомните руками в миске."},
    {"text": "Добавьте хмели-сунели, соль, чёрный перец, растительное масло и перемешайте."},
    {"text": "Влейте газированную воду и ещё раз хорошо перемешайте."},
    {"text": "Добавьте мясо и тщательно перемешайте руками, чтобы каждый кусочек был покрыт маринадом. Накройте крышкой или плёнкой и уберите в холодильник на 6–8 часов (лучше на ночь)."},
    {"text": "Достаньте мясо за 30 минут до жарки, чтобы оно немного согрелось."},
    {"text": "Жарьте на углях, периодически переворачивая, 20–25 минут до готовности и румяной корочки."}
  ],
  "tips": [
    "Чтобы шашлык получился ещё сочнее, не передерживайте мясо на огне и дайте ему немного «отдохнуть» под фольгой после приготовления — 5–10 минут будет достаточно."
  ],
  "card": {
    "image": "cards/shashlyk-iz-svinoy-shei.jpg",
    "theme": "green",
    "sticker": "Сочный, ароматный и с аппетитной корочкой! Настоящий шашлык из свиной шеи!",
    "footer": "Приятного аппетита!"
  },
  "photo": "photos/shashlyk-iz-svinoy-shei.jpg",
  "author": "Юля",
  "added": "2026-10-16"
}
