{
  "id": "cukini-baklazhan-parmidzhano",
  "title": "Цукини (баклажан) Пармиджано",
  "description": "Сочная запеканка из цукини (или баклажан) под томатным соусом с расплавленной моцареллой и ароматным пармезаном. Просто, сытно и очень вкусно!",
  "category": "goryachee",
  "tags": ["овощи", "с сыром", "запеканка", "итальянское"],
  "servings": {"qty": [4, 6], "unit": "порций"},
  "time": {"text": "~1 ч 10 мин", "minutes": 70},
  "ingredients": [
    {
      "group": null,
      "items": [
        {"name": "Кабачок (или баклажан)", "key": "кабачок", "qty": [2, 3], "unit": "шт."},
        {"name": "Панировочные сухари", "key": "панировочные сухари", "qty": 1, "unit": "стакан"},
        {"name": "Перетёртые томаты", "key": "помидоры", "qty": 250, "unit": "мл"},
        {"name": "Сахар", "key": "сахар", "qty": 1, "unit": "ч. л."},
        {"name": "Чеснок", "key": "чеснок", "qty": [2, 3], "unit": "зубчик"},
        {"name": "Базилик (листья)", "key": "базилик", "amount": "по вкусу"},
        {"name": "Моцарелла рассольная", "key": "моцарелла", "qty": 200, "unit": "г"},
        {"name": "Пармезан", "key": "пармезан", "qty": 30, "unit": "г"},
        {"name": "Соль", "key": "соль", "amount": "по вкусу"}
      ]
    }
  ],
  "steps": [
    {"text": "Кабачки (или баклажаны) нарезать кружочками толщиной ~0,5 см."},
    {"text": "Выложить на противень, посолить и запекать при 200 °C до лёгкого румянца."},
    {"text": "Для соуса: в сотейнике обжарить чеснок, добавить перетёртые томаты, сахар, соль и базилик. Тушить 10–15 минут."},
    {"text": "В форму для запекания выложить немного соуса."},
    {"text": "Слой кабачков → соус → моцарелла → немного пармезана и панировочные сухари."},
    {"text": "Повторять слои, пока не закончатся ингредиенты. Последний слой — соус, моцарелла, пармезан и панировочные сухари."},
    {"text": "Запекать при 180 °C до румяной корочки и пузырьков 20–25 минут."},
    {"text": "Дать постоять 10 минут перед подачей."},
    {"text": "Подавать с листиками свежего базилика."}
  ],
  "tips": [
    "Чтобы запеканка была ещё вкуснее, дай ей немного постоять 10 минут после духовки — так слои лучше схватятся, а вкус станет насыщеннее."
  ],
  "card": {
    "image": "cards/cukini-baklazhan-parmidzhano.jpg",
    "theme": "green",
    "footer": "Приятного аппетита!"
  },
  "photo": "photos/cukini-baklazhan-parmidzhano.jpg",
  "author": "Юля",
  "added": "2026-10-16"
}
