{
  "id": "bombicheskie-krevetki-saganaki",
  "title": "Бомбические креветки саганаки",
  "description": "Яркие, сочные креветки в томатно-перечном соусе с фетой и лимоном. Невероятно ароматное и полезное блюдо в греческом стиле!",
  "category": "goryachee",
  "tags": ["морепродукты", "греческое"],
  "servings": {"qty": [3, 4], "unit": "порции"},
  "time": {"text": "~45 минут", "minutes": 45},
  "ingredients": [
    {
      "group": null,
      "items": [
        {"name": "Креветки", "key": "креветки", "qty": 500, "unit": "г"},
        {"name": "Чеснок", "key": "чеснок", "qty": 2, "unit": "зубчик"},
        {"name": "Белое вино", "key": "вино", "qty": 50, "unit": "мл"},
        {"name": "Лук", "key": "лук", "qty": 1, "unit": "шт."},
        {"name": "Перетёртые томаты в с/соку", "key": "помидоры", "qty": 250, "unit": "мл"},
        {"name": "Сахар", "key": "сахар", "qty": 1, "unit": "ч. л."},
        {"name": "Базиликовое масло", "key": "базиликовое масло", "qty": 1, "unit": "ст. л."},
        {"name": "Болгарский перец печёный", "key": "болгарский перец", "qty": 2, "unit": "шт."},
        {"name": "Вяленые томаты", "key": "вяленые томаты", "qty": 5, "unit": "шт."},
        {"name": "Каперсы", "key": "каперсы", "qty": 2, "unit": "ч. л."},
        {"name": "Фета", "key": "фета", "qty": 300, "unit": "г"},
        {"name": "Цедра лимона", "key": "лимон", "qty": 1, "unit": "ч. л."},
        {"name": "Оливковое масло", "key": "оливковое масло", "qty": [2, 3], "unit": "ст. л."},
        {"name": "Петрушка и мята", "key": "петрушка", "amount": "для подачи"},
        {"name": "Соль", "key": "соль", "amount": "по вкусу"}
      ]
    }
  ],
  "steps": [
    {"text": "Если нет консервированного запечённого перца, запечь болгарский перец при 180 °C 30–35 минут. Очистить от кожицы, дать остыть и измельчить в блендере до пюре."},
    {"text": "Креветки обжарить на оливковом масле 1 минуту. Добавить чеснок и вино, жарить ещё 1 минуту. Переложить в миску."},
    {"text": "На той же сковороде обжарить лук до золотистости."},
    {"text": "Добавить перетёртые томаты, сахар и базиликовое масло. Тушить 10 минут до загустения."},
    {"text": "Добавить пюре из запечённых перцев, вяленые томаты и каперсы. Варить ещё 15 минут. Посолить по вкусу."},
    {"text": "Переложить креветки в соус и перемешать."},
    {"text": "Выложить в форму для запекания. Сверху крошить фету, натереть цедру лимона и полить оливковым маслом."},
    {"text": "Запекать при 180 °C 5 минут."},
    {"text": "Перед подачей посыпать рубленой петрушкой и мятой."},
    {"text": "Подавать с поджаренным в тостере ломтиком хлеба."}
  ],
  "tips": [],
  "notes": [
    {
      "title": "Заметки",
      "items": [
        "Отлично с поджаренным хлебом.",
        "Можно заменить фету брынзой.",
        "Для аромата добавить орегано.",
        "Соус вкусен даже без креветок — как дип к хлебу!"
      ]
    }
  ],
  "card": {"image": "cards/bombicheskie-krevetki-saganaki.jpg", "theme": "terracotta"},
  "photo": "photos/bombicheskie-krevetki-saganaki.jpg",
  "author": "Юля",
  "added": "2026-10-16"
}
