{
  "id": "hokkaydo-yaponskiy-molochnyy-hleb",
  "title": "Хоккайдо — японский молочный хлеб",
  "description": "Невероятно нежный, в меру сладкий хлеб с молочным вкусом и воздушной текстурой. Готовится просто, а результат всегда впечатляет!",
  "category": "vypechka",
  "tags": ["дрожжевое тесто", "хлеб"],
  "servings": {"qty": 1, "unit": "форма"},
  "time": {"text": "~3–3,5 часа", "note": "с расстойкой", "minutes": [180, 210]},
  "equipment": "Форма 26×11×7 см",
  "ingredients": [
    {
      "group": null,
      "items": [
        {"name": "Мука сильная", "key": "мука", "qty": 360, "unit": "г"},
        {"name": "Дрожжи инстантные", "key": "дрожжи", "qty": 6, "unit": "г"},
        {"name": "Сахар", "key": "сахар", "qty": 50, "unit": "г"},
        {"name": "Молоко сухое", "key": "сухое молоко", "qty": 25, "unit": "г"},
        {"name": "Масло сливочное 82,5%", "key": "сливочное масло", "qty": 40, "unit": "г"},
        {"name": "Молоко", "key": "молоко", "qty": 235, "unit": "г"},
        {"name": "Соль", "key": "соль", "qty": 5, "unit": "г"}
      ]
    },
    {
      "group": "Обмазка",
      "items": [
        {"name": "Яйцо", "key": "яйцо", "qty": 1, "unit": "шт."},
        {"name": "Сливки", "key": "сливки", "qty": 1, "unit": "ст. л."}
      ]
    }
  ],
  "steps": [
    {"text": "В большой чаше соединяем сильную муку, дрожжи, сахар и сухое молоко. Перемешиваем венчиком до однородности."},
    {"text": "Добавляем мягкое сливочное масло и молоко комнатной температуры. Начинаем вымешивать тесто руками или насадкой-крюком."},
    {"text": "Когда тесто станет более гладким, добавляем соль. Соль регулирует работу дрожжей, поэтому вводим её в конце."},
    {"text": "Вымешиваем до мягкого, эластичного состояния. Тесто должно быть гладким, нежным и слегка тянуться."},
    {"text": "Кладём тесто в чашу, накрываем плёнкой и ставим в тёплое место на 1 час."},
    {"text": "Через час тесто поднимется примерно вдвое. Обминаем его, чтобы выпустить газ — просто слегка прижимаем руками."},
    {"text": "Делим тесто на четыре равные части. Каждую часть округляем: сверху делаем гладкую поверхность, все складки собираем снизу."},
    {"text": "Укладываем шарики в форму. Накрываем плёнкой и оставляем в тепле ещё на 30 минут — тесто должно подняться почти до края формы."},
    {"text": "Смазываем верх подготовленной обмазкой кисточкой (яйцо смешать со сливками)."},
    {"text": "Выпекаем при 175 °C примерно 25–35 минут. Ставим форму чуть ниже центра, чтобы верх не зарумянился слишком рано. Когда хлеб стал румяным (в складках остаётся светлее), держим ещё 2–3 минуты и достаём."},
    {"text": "Готовый хлеб прямо в форме накрываем полотенцем. Так он останется мягким и не потеряет влагу."}
  ],
  "tips": [
    "Добавляем соль в самом конце, когда глютен уже достаточно развит. Это регулирует работу дрожжей и делает текстуру хлеба нежной и воздушной."
  ],
  "notes": [
    {
      "title": "Хозяйке на заметку",
      "items": [
        "Про муку: ищите сильную муку с белком 13–14%. Именно она даёт ту самую волокнистую структуру. С обычной мукой хлеб получится более кексовым.",
        "Про дрожжи: не уменьшайте количество дрожжей — это влияет на подъём и вкус хлеба.",
        "Про тесто: оно должно быть очень мягким и нежным. Лучше чуть липкое, чем забитое мукой.",
        "Про расстойку: идеальная температура — 26–30 °C. Если холодно — ставьте в духовку с кружкой кипятка.",
        "Про форму: форма влияет на результат. Если теста будет больше на 10–15%, хлеб может «убежать» или треснуть сверху.",
        "Про мягкость: секрет — накрыть хлеб полотенцем сразу после выпечки. Он «дойдёт» и останется нежным."
      ]
    },
    {
      "title": "Результат",
      "items": [
        "Мякиш белоснежный, нежный и волокнистый — хлеб легко «рвётся нитями». Идеален для тостов, бутербродов или просто с маслом."
      ]
    }
  ],
  "card": {"image": "cards/hokkaydo-yaponskiy-molochnyy-hleb.jpg", "theme": "plum"},
  "photo": "photos/hokkaydo-yaponskiy-molochnyy-hleb.jpg",
  "author": "Юля",
  "added": "2026-10-16"
}
