{
  "id": "slivochnyy-sup-s-ryboy",
  "title": "Сливочный суп с рыбой",
  "description": "Нежный, ароматный суп с кремовой текстурой и насыщенным вкусом рыбы. Можно готовить из сёмги, форели или горбуши — всегда получается очень вкусно!",
  "category": "supy",
  "tags": ["рыба"],
  "servings": {"qty": [4, 6], "unit": "порций"},
  "time": {"text": "~50–60 минут", "minutes": [50, 60]},
  "ingredients": [
    {
      "group": null,
      "items": [
        {"name": "Филе сёмги / форели / горбуши", "key": "красная рыба", "qty": 300, "unit": "г"},
        {"name": "Картофель", "key": "картофель", "qty": 500, "unit": "г"},
        {"name": "Помидоры", "key": "помидоры", "qty": 300, "unit": "г"},
        {"name": "Лук", "key": "лук", "qty": 1, "unit": "шт."},
        {"name": "Морковь", "key": "морковь", "qty": 150, "unit": "г"},
        {"name": "Сельдерей", "key": "сельдерей", "qty": [1, 2], "unit": "стебля"},
        {"name": "Сливки 10–20%", "key": "сливки", "qty": 500, "unit": "мл"},
        {"name": "Растительное масло", "key": "растительное масло", "amount": "для жарки"},
        {"name": "Соль", "key": "соль", "amount": "по вкусу"},
        {"name": "Душистый перец", "key": "душистый перец", "qty": [3, 5], "unit": "горошин"},
        {"name": "Лавровый лист", "key": "лавровый лист", "qty": [1, 2], "unit": "шт."},
        {"name": "Зелень", "key": "зелень", "amount": "по вкусу"},
        {"name": "Пшено или кускус", "key": "пшено", "qty": 100, "unit": "г", "optional": true, "approx": true}
      ]
    }
  ],
  "steps": [
    {"title": "Бульон", "text": "Рыбу залить водой и поставить вариться. После закипания снять пену, добавить 1 ч. л. соли."},
    {"title": "Овощи в бульон", "text": "Добавить очищенные морковь, лук, сельдерей и душистый перец. Варить ~20 минут на слабом огне под крышкой."},
    {"title": "Подготовка", "text": "Достать рыбу, бульон процедить."},
    {"title": "Зажарка", "text": "Обжарить лук, морковь (мелко натёртую) и помидоры кубиком."},
    {"title": "Основа супа", "text": "Бульон снова довести до кипения, добавить картофель кубиками."},
    {"title": "Крупа (по желанию)", "text": "Если используешь пшено — добавить вместе с картофелем. Варить ~10 минут. Если используешь кускус — добавить в самом конце."},
    {"title": "Сборка", "text": "Добавить зажарку, лавровый лист, душистый перец и разобранную на кусочки рыбу."},
    {"title": "Сливки", "text": "Влить сливки, варить ещё 5–7 минут."},
    {"title": "Финал", "text": "Если используешь кускус — добавить в самом конце. Дать настояться пару минут."}
  ],
  "tips": [
    "С горбушей получается более лёгкий вариант, а с сёмгой — максимально насыщенный.",
    "Не переваривай сливки — суп останется нежным и кремовым."
  ],
  "card": {"image": "cards/slivochnyy-sup-s-ryboy.jpg", "theme": "plum"},
  "photo": "photos/slivochnyy-sup-s-ryboy.jpg",
  "author": "Юля",
  "added": "2026-10-16"
}
