{
  "id": "keks-tvorozhnyy",
  "title": "Кекс «Творожный»",
  "description": "Нежный творожный кекс с лимонной цедрой. Очень важно, чтобы творог для этого кекса был сухим и без крупинок.",
  "category": "vypechka",
  "tags": ["сладкое", "к чаю"],
  "time": {"text": "~1 час 15 минут", "minutes": 75},
  "equipment": "Форма 10×20 см, 170 °C",
  "ingredients": [
    {
      "group": null,
      "items": [
        {"name": "Мука", "key": "мука", "qty": 150, "unit": "г"},
        {"name": "Сахар", "key": "сахар", "qty": 160, "unit": "г"},
        {"name": "Сливочное масло", "key": "сливочное масло", "qty": 75, "unit": "г"},
        {"name": "Яйца", "key": "яйцо", "qty": 2, "unit": "шт.", "alt": "80 г"},
        {"name": "Творог жирностью 18%", "key": "творог", "qty": 130, "unit": "г"},
        {"name": "Ванильный сахар", "key": "ванильный сахар", "qty": 1, "unit": "пакетик", "alt": "10 г"},
        {"name": "Разрыхлитель", "key": "разрыхлитель", "qty": 1, "unit": "ч. л."},
        {"name": "Сахарная пудра", "key": "сахарная пудра", "qty": 1, "unit": "ч. л."},
        {"name": "Цедра лимона", "key": "лимон", "qty": 1, "unit": "ч. л."}
      ]
    }
  ],
  "steps": [
    {"text": "Форму для кекса 10×20 см смазать маслом и посыпать мукой. Духовку разогреть до 170 °C."},
    {"text": "Масло с сахаром и ванильным сахаром тщательно смешайте миксером на средней скорости. Добавьте протёртый через сито творог и взбейте."},
    {"text": "Влейте яйца, хорошо размешайте смесь до получения однородной массы."},
    {"text": "Всыпьте муку, просеянную с разрыхлителем, и хорошо (около 1 минуты на малой скорости) вымесите тесто."},
    {"text": "Выложите тесто в форму и пеките около часа."},
    {"text": "Готовый кекс посыпьте сахарной пудрой."}
  ],
  "tips": [],
  "notes": [
    {
      "title": "Очень важно",
      "items": [
        "Творог для этого кекса должен быть сухим и без крупинок: слишком влажный творог делает тесто клёклым и плотным. Жирность творога тоже играет роль — с обезжиренным творогом кекс получится более плотным и сухим."
      ]
    }
  ],
  "card": {"image": "cards/keks-tvorozhnyy.jpg", "theme": "terracotta"},
  "photo": "photos/keks-tvorozhnyy.jpg",
  "author": "Юля",
  "added": "2026-10-16"
}
