{
  "id": "salat-s-funchozoy",
  "title": "Салат с фунчозой",
  "description": "Яркий, сытный и очень вкусный салат с фунчозой, курицей, корейской морковью, свежими огурцами и яичными блинчиками. Пикантный и насыщенный — отлично подойдёт и на каждый день, и на стол!",
  "category": "salaty",
  "tags": ["с курицей", "азиатское"],
  "servings": {"qty": [3, 4], "unit": "порции"},
  "time": {"text": "~30–40 минут", "minutes": [30, 40]},
  "ingredients": [
    {
      "group": null,
      "items": [
        {"name": "Фунчоза", "key": "фунчоза", "qty": 150, "unit": "г"},
        {"name": "Курица", "note": "отварная или запечённая", "key": "курица", "qty": 300, "unit": "г"},
        {"name": "Огурцы свежие", "key": "огурец", "qty": 2, "unit": "шт."},
        {"name": "Морковь по-корейски", "key": "корейская морковь", "qty": [150, 200], "unit": "г"},
        {"name": "Яйца", "key": "яйцо", "qty": 3, "unit": "шт."},
        {"name": "Кунжут", "key": "кунжут", "qty": [2, 3], "unit": "ст. л."},
        {"name": "Соевый соус", "key": "соевый соус", "qty": [3, 4], "unit": "ст. л."},
        {"name": "Кунжутное масло", "key": "кунжутное масло", "qty": [1, 2], "unit": "ст. л."}
      ]
    }
  ],
  "steps": [
    {"title": "Фунчозу приготовить", "text": "Залить кипятком на 5–7 минут (или по инструкции), промыть холодной водой."},
    {"title": "Курицу подготовить", "text": "Нарезать тонкой соломкой или разобрать на волокна."},
    {"title": "Яичные блинчики", "text": "Яйца взбить, пожарить тонкие блинчики, остудить и нарезать соломкой."},
    {"title": "Огурцы нарезать", "text": "Тонкой соломкой."},
    {"title": "Собрать салат", "text": "Смешать фунчозу, курицу, огурцы, морковь по-корейски и яичные блинчики."},
    {"title": "Заправка", "text": "Добавить соевый соус и кунжутное масло, перемешать."},
    {"title": "Подача", "text": "Посыпать кунжутом и сразу подавать."}
  ],
  "tips": [
    "Если морковь уже с заправкой — дополнительно соль не нужна. Можно добавить немного чеснока или чили для остроты."
  ],
  "card": {"image": "cards/salat-s-funchozoy.jpg", "theme": "plum"},
  "photo": "photos/salat-s-funchozoy.jpg",
  "author": "Юля",
  "added": "2026-10-16"
}
