{
  "id": "bedra-kurinye-bez-zharki",
  "title": "Бёдра куриные без жарки",
  "description": "Хрустящие куриные бёдрышки без жарки с минимумом масла и возни! Буквально полчаса и ужин на всю семью готов!",
  "category": "goryachee",
  "tags": ["с курицей", "в духовке"],
  "servings": {"qty": [4, 6], "unit": "порций"},
  "time": {"text": "~50 минут", "note": "+ ночь в холодильнике", "minutes": 50},
  "equipment": "Духовка 200 °C",
  "ingredients": [
    {
      "group": null,
      "items": [
        {"name": "Бёдра куриные", "note": "примерно 6 шт.", "key": "курица", "qty": 1, "unit": "упаковка"},
        {"name": "Оливковое масло", "key": "оливковое масло", "qty": [1, 2], "unit": "ст. л."},
        {"name": "Соль", "key": "соль", "amount": "по вкусу"},
        {"name": "Перец чёрный", "key": "чёрный перец", "amount": "по вкусу"},
        {"name": "Сушёный чеснок", "key": "чеснок", "qty": 0.5, "unit": "ч. л."},
        {"name": "Шрирача", "key": "шрирача", "qty": 0.5, "unit": "ч. л.", "optional": true},
        {"name": "Панировочные сухари Панко", "key": "панировочные сухари", "amount": "для панировки"},
        {"name": "Яйцо куриное", "key": "яйцо", "qty": 2, "unit": "шт."}
      ]
    }
  ],
  "steps": [
    {"text": "Бёдра промойте и обсушите бумажным полотенцем."},
    {"text": "Замаринуйте бёдра: смешайте оливковое масло, соль, перец, сушёный чеснок и немного шрирачи (по желанию). Хорошо натрите смесью курицу со всех сторон."},
    {"text": "Накройте и уберите в холодильник минимум на 2 часа (лучше на ночь)."},
    {"text": "Подготовьте яичную смесь: взбейте яйца с щепоткой соли и перца."},
    {"text": "Подготовьте панировочные сухари Панко: при желании смешайте с солью и перцем."},
    {"text": "Обмакните бёдра сначала в яичную смесь, затем обваляйте в панировочных сухарях с двух сторон. Выложите на противень с пергаментом, слегка сбрызните оливковым маслом."},
    {"text": "Духовку разогрейте до 200 °C. Запекайте бёдра примерно 25–30 минут, до румяной корочки и готовности (время может варьироваться в зависимости от размера)."},
    {"text": "Подавайте с любимым гарниром или овощным салатом. Быстрый, лёгкий, вкусный ужин готов!"}
  ],
  "tips": [],
  "card": {"image": "cards/bedra-kurinye-bez-zharki.jpg", "theme": "plum"},
  "photo": "photos/bedra-kurinye-bez-zharki.jpg",
  "author": "Юля",
  "added": "2026-10-16"
}
