{
  "id": "pampushki-s-chesnochkom",
  "title": "Пампушки с чесночком",
  "description": "Мягкие, воздушные, с ароматной чесночной заправкой и расплавленным сыром внутри. Идеальны к борщу, супам и просто так!",
  "category": "vypechka",
  "tags": ["дрожжевое тесто", "к супу", "с сыром"],
  "time": {"text": "~2 часа", "note": "из них ~25 минут выпечки", "minutes": 120},
  "ingredients": [
    {
      "group": "Тесто",
      "items": [
        {"name": "Тёплое молоко", "key": "молоко", "qty": 250, "unit": "мл"},
        {"name": "Яйца", "key": "яйцо", "qty": 2, "unit": "шт."},
        {"name": "Растительное масло", "key": "растительное масло", "qty": 4, "unit": "ст. л."},
        {"name": "Соль", "key": "соль", "qty": 1, "unit": "ч. л."},
        {"name": "Сахар", "key": "сахар", "qty": 1, "unit": "ст. л."},
        {"name": "Мука", "key": "мука", "qty": 500, "unit": "г"},
        {"name": "Сухие дрожжи", "key": "дрожжи", "qty": 11, "unit": "г"},
        {"name": "Маленькие шарики моцареллы", "note": "или любой хорошо плавящийся сыр", "key": "моцарелла", "qty": [10, 14], "unit": "шт."}
      ]
    },
    {
      "group": "Соус",
      "items": [
        {"name": "Чеснок", "key": "чеснок", "qty": [2, 3], "unit": "зубчик"},
        {"name": "Укроп или петрушка", "key": "укроп", "amount": "несколько веточек"},
        {"name": "Сливочное масло", "key": "сливочное масло", "qty": [2, 4], "unit": "ст. л."},
        {"name": "Соль", "key": "соль", "amount": "щепотка"}
      ]
    },
    {
      "group": "Для смазывания",
      "items": [
        {"name": "Желток", "key": "яйцо", "qty": 1, "unit": "шт."},
        {"name": "Молоко", "key": "молоко", "qty": [1, 2], "unit": "ст. л."}
      ]
    }
  ],
  "steps": [
    {"text": "В тёплом молоке растворите дрожжи, добавьте сахар и соль. Перемешайте и оставьте на 10–15 минут для активации дрожжей."},
    {"text": "Добавьте яйца, растительное масло и постепенно всыпьте муку. Замесите мягкое, эластичное тесто (я использую миксер с насадкой-крюк)."},
    {"text": "Накройте миску с тестом полотенцем и оставьте в тёплом месте на 1 час. Тесто должно увеличиться в объёме вдвое."},
    {"text": "Обомните тесто и дайте ему подойти ещё 20 минут."},
    {"text": "Разделите тесто на небольшие кусочки весом примерно по 50 г. Сформируйте круглые шарики."},
    {"text": "В каждый шарик положите по кусочку сыра и защипните края."},
    {"text": "Смажьте форму для выпечки сливочным маслом и выложите пампушки на небольшом расстоянии друг от друга."},
    {"text": "Накройте полотенцем и дайте подойти 10 минут."},
    {"text": "Смажьте пампушки смесью желтка с молоком."},
    {"text": "Выпекайте в разогретой духовке: первые 20 минут при 200 °C, затем снизьте температуру до 180 °C и выпекайте ещё 5–10 минут до золотистой корочки."},
    {"title": "Чесночный соус", "text": "Растопите сливочное масло. Добавьте измельчённый чеснок, мелко нарезанную зелень и немного соли. Хорошо перемешайте. Горячие пампушки сразу же смажьте чесночным соусом — каждую со всех сторон. Аромат будет невероятным!"}
  ],
  "tips": [
    "Пампушки вкуснее всего в тёплом виде! Не жалейте чесночного масла — именно оно делает их невероятно ароматными!"
  ],
  "card": {"image": "cards/pampushki-s-chesnochkom.jpg", "theme": "green"},
  "photo": "photos/pampushki-s-chesnochkom.jpg",
  "author": "Юля",
  "added": "2026-10-16"
}
