{
  "id": "limonnyy-tart",
  "title": "Лимонный тарт",
  "description": "Нежное песочное тесто и шелковистая лимонная начинка — идеальное сочетание кислинки и сладости.",
  "category": "deserty",
  "tags": ["сладкое", "к чаю"],
  "servings": {"qty": [8, 10], "unit": "порций"},
  "time": {"text": "~1 ч 30 мин", "note": "+ 2 часа в холодильнике", "minutes": 90},
  "equipment": "Форма ⌀ 22–24 см",
  "ingredients": [
    {
      "group": "Тесто",
      "items": [
        {"name": "Мука", "key": "мука", "qty": 355, "unit": "г"},
        {"name": "Сливочное масло", "key": "сливочное масло", "qty": 180, "unit": "г"},
        {"name": "Сметана 10%", "key": "сметана", "qty": 180, "unit": "г"},
        {"name": "Разрыхлитель", "key": "разрыхлитель", "qty": 5, "unit": "г"},
        {"name": "Соль", "key": "соль", "qty": 0.3333333333333333, "unit": "ч. л."},
        {"name": "Цедра", "note": "цедра ½ лимона", "key": "лимон", "qty": 0.5, "unit": "шт."}
      ]
    },
    {
      "group": "Начинка",
      "items": [
        {"name": "Лимон", "note": "всего для рецепта нужно 2 лимона: один — в начинку, один — для цедры в тесто", "key": "лимон", "qty": 1, "unit": "шт."},
        {"name": "Сахар", "key": "сахар", "qty": 195, "unit": "г"},
        {"name": "Кукурузный крахмал", "key": "крахмал", "qty": 1, "unit": "ст. л."}
      ]
    }
  ],
  "steps": [
    {"text": "Приготовьте тесто. Муку, сахарную пудру и соль смешайте в миске. Добавьте холодное сливочное масло кусочками и перетрите в крошку. Добавьте желток и быстро замесите тесто."},
    {"text": "Сформируйте шар, заверните в плёнку и уберите в холодильник на 30–40 минут."},
    {"text": "Раскатайте тесто и выложите в форму для тарта (⌀ 22–24 см), формируя бортики. Проколите дно вилкой."},
    {"text": "Выпекайте в разогретой до 180 °C духовке 15–18 минут до лёгкого золотистого цвета. Остудите."},
    {"text": "Приготовьте начинку. С лимонов снимите цедру и выжмите сок. В миске взбейте яйца с сахаром до однородности."},
    {"text": "Добавьте лимонный сок, цедру и размягчённое сливочное масло. Тщательно перемешайте."},
    {"text": "Вылейте начинку на остывшую основу и выпекайте при 160 °C ещё 20–25 минут, пока начинка не загустеет (в центре может слегка дрожать)."},
    {"text": "Остудите тарт при комнатной температуре, затем уберите в холодильник минимум на 2 часа."},
    {"text": "Перед подачей украсьте по желанию: дольками лимона, мятой и сахарной пудрой."}
  ],
  "tips": [
    "Для более насыщенного вкуса добавьте в начинку немного цедры лайма. А перед подачей охладите тарт в холодильнике 2–3 часа — так он станет ещё нежнее!"
  ],
  "card": {"image": "cards/limonnyy-tart.jpg", "theme": "green", "footer": "Приятного чаепития!"},
  "photo": "photos/limonnyy-tart.jpg",
  "author": "Юля",
  "added": "2026-10-16"
}
