{
  "id": "malinovyy-pirog-s-fistashkovoy-kroshkoy",
  "title": "Малиновый пирог с фисташковой крошкой",
  "description": "Сочная малина, нежное фисташковое тесто, хрустящая крошка и тонкая фисташковая глазурь. Яркий вкус и идеальный баланс — просто, но как в хорошей кофейне!",
  "category": "pirogi",
  "tags": ["сладкое", "к чаю"],
  "servings": {"qty": [8, 10], "unit": "порций"},
  "time": {"text": "~1 час", "note": "+ охлаждение", "minutes": 60},
  "equipment": "Форма Ø 20–22 см",
  "ingredients": [
    {
      "group": "Малиновая начинка",
      "items": [
        {"name": "Малина", "key": "малина", "qty": 430, "unit": "г"},
        {"name": "Сахар", "key": "сахар", "qty": 60, "unit": "г"},
        {"name": "Кукурузный крахмал", "key": "крахмал", "qty": 20, "unit": "г"}
      ]
    },
    {
      "group": "Фисташковое тесто (дно и крошка)",
      "items": [
        {"name": "Мука", "key": "мука", "qty": 200, "unit": "г"},
        {"name": "Сливочное масло", "note": "холодное", "key": "сливочное масло", "qty": 120, "unit": "г"},
        {"name": "Сахар", "key": "сахар", "qty": 70, "unit": "г"},
        {"name": "Фисташки", "note": "без соли", "key": "фисташки", "qty": 60, "unit": "г"},
        {"name": "Соль", "key": "соль", "amount": "щепотка"}
      ]
    },
    {
      "group": "Дополнительно",
      "items": [
        {"name": "Фисташковая паста", "key": "фисташковая паста", "qty": 30, "unit": "г"},
        {"name": "Дроблёные фисташки", "key": "фисташки", "qty": [20, 30], "unit": "г"},
        {"name": "Фисташковая глазурь", "note": "сухой смеси, плюс кипяток и растительное масло по инструкции на упаковке", "key": "фисташковая глазурь", "qty": [25, 30], "unit": "г"}
      ]
    }
  ],
  "steps": [
    {"title": "Приготовить малиновую начинку", "text": "Малину с сахаром прогреть в сотейнике, размять и довести до лёгкого кипения. Крахмал развести в небольшом количестве холодной воды, влить в малину и, помешивая, проварить 2–3 минуты до загустения. Остудить."},
    {"title": "Приготовить фисташковое тесто", "text": "Фисташки измельчить. Смешать муку, сахар, соль и фисташки. Добавить холодное сливочное масло и перетереть в крупную крошку."},
    {"title": "Собрать основу", "text": "Около 55–60% крошки утрамбовать на дно формы (диаметр 20–22 см), застеленной пергаментом. Выпекать при 180 °C 10–12 минут."},
    {"title": "Собрать пирог", "text": "На подпечённое дно выложить остывшую малиновую начинку. Сверху распределить фисташковую пасту не сплошным слоем, а небольшими островками. Засыпать оставшейся крошкой и посыпать дроблёными фисташками."},
    {"title": "Выпекать", "text": "Печь при 180 °C около 25 минут (начиная проверять с 22-й минуты), до золотистой крошки."},
    {"title": "Остудить", "text": "Полностью остудить и убрать в холодильник минимум на 2–3 часа — так пирог лучше держит форму и легче режется."},
    {"title": "Глазурь", "text": "Развести сухую фисташковую глазурь кипятком и добавить немного растительного масла (по инструкции). Нанести тонкими полосками на холодный пирог."}
  ],
  "tips": [
    "Пирог особенно вкусный на следующий день, когда все слои «подружатся». Хранить в холодильнике до 4 дней."
  ],
  "notes": [
    {
      "title": "Можно попробовать",
      "items": [
        "Добавить в начинку немного лимонной цедры — она подчёркивает вкус малины.",
        "Часть фисташек заменить миндалём или фундуком.",
        "Вместо фисташковой глазури использовать белый шоколад с каплей фисташковой пасты.",
        "Для более яркого вкуса — добавить щепотку кардамона или ванили."
      ]
    },
    {
      "title": "Важно",
      "items": [
        "Не уменьшайте количество крахмала в начинке — 20 г на 430 г малины оптимально: начинка остаётся сочной, но хорошо держит форму."
      ]
    }
  ],
  "card": {
    "image": "cards/malinovyy-pirog-s-fistashkovoy-kroshkoy.jpg",
    "theme": "green",
    "sticker": "Сочный. Фисташковый. Невероятно вкусный!",
    "aside": "Любовь с первого кусочка!",
    "footer": "Простые рецепты для вкусных моментов"
  },
  "photo": "photos/malinovyy-pirog-s-fistashkovoy-kroshkoy.jpg",
  "author": "Юля",
  "added": "2026-10-16"
}
