{
  "id": "salat-s-pechenym-percem-i-syrom",
  "title": "Салат с печёным перцем и сыром",
  "description": "Яркий, сочный и ароматный салат с печёным перцем и жареным сыром. Лёгкий, но очень насыщенный вкус! Идеально на каждый день.",
  "category": "salaty",
  "tags": ["овощи", "с сыром"],
  "servings": {"qty": [3, 4], "unit": "порции"},
  "time": {"text": "~40 минут", "minutes": 40},
  "ingredients": [
    {
      "group": "Для салата",
      "items": [
        {"name": "Болгарский перец", "key": "болгарский перец", "qty": 2, "unit": "шт."},
        {"name": "Адыгейский сыр", "key": "сыр", "amount": "по желанию"},
        {"name": "Чеснок", "key": "чеснок", "qty": 2, "unit": "зубчик"},
        {"name": "Салат микс", "key": "салат", "qty": 60, "unit": "г"},
        {"name": "Помидоры", "key": "помидоры", "qty": [3, 4], "unit": "шт."},
        {"name": "Крымский (ялтинский) лук", "key": "лук", "qty": 0.3333333333333333, "unit": "шт."}
      ]
    },
    {
      "group": "Для заправки",
      "items": [
        {"name": "Оливковое масло", "key": "оливковое масло", "qty": 80, "unit": "мл"},
        {"name": "Зелёный базилик", "key": "базилик", "amount": "горсть"},
        {"name": "Яблочный уксус", "key": "уксус", "qty": 1, "unit": "ст. л."},
        {"name": "Бальзамик крем", "key": "бальзамик", "qty": 1, "unit": "ч. л."},
        {"name": "Чеснок", "key": "чеснок", "qty": 1, "unit": "зубчик"},
        {"name": "Соль", "key": "соль", "amount": "щепотка"}
      ]
    }
  ],
  "steps": [
    {"text": "Болгарский перец разрежьте пополам, очистите от семян и перегородок. Смажьте оливковым маслом и запекайте в духовке при 200 °C около 35 минут."},
    {"text": "Готовый перец переложите в миску, накройте крышкой и дайте ему остыть. Очистите от кожицы и нарежьте тонкими полосками."},
    {"text": "Приготовьте заправку: все ингредиенты для заправки сложите в блендер и измельчите до однородности. Попробуйте и при необходимости добавьте соль, сахар или мёд."},
    {"text": "Сыр нарежьте кусочками толщиной около 1 см и обжарьте на небольшом количестве масла с двух сторон до румяной корочки. Для аромата можно предварительно обжарить в масле раздавленный чеснок."},
    {"text": "В салатницу выложите салатный микс, добавьте нарезанные помидоры, печёный перец, лук и жареный сыр."},
    {"text": "Полейте салат заправкой, перемешайте и подавайте!"}
  ],
  "tips": [],
  "notes": [
    {
      "title": "Заметки",
      "items": [
        "Перец можно запечь заранее.",
        "Сыр отлично заменить на халуми.",
        "Для заправки можно добавить щепотку сахара или мёда.",
        "Подавайте сразу после приготовления."
      ]
    }
  ],
  "card": {
    "image": "cards/salat-s-pechenym-percem-i-syrom.jpg",
    "theme": "terracotta",
    "footer": "Этот салат непременно вам понравится!"
  },
  "photo": "photos/salat-s-pechenym-percem-i-syrom.jpg",
  "author": "Юля",
  "added": "2026-10-16"
}
