{
  "id": "bulochki-s-izyumom",
  "title": "Булочки с изюмом",
  "description": "Очень мягкие, воздушные и ароматные булочки с золотистой корочкой. Долго остаются свежими благодаря танчжону.",
  "category": "vypechka",
  "tags": ["сладкое", "дрожжевое тесто", "к чаю"],
  "servings": {"qty": 12, "unit": "булочек"},
  "time": {"text": "3,5 часа", "note": "с учётом расстойки", "minutes": 210},
  "difficulty": "средняя",
  "equipment": "Форма примерно 20×30 см",
  "ingredients": [
    {
      "group": "Танчжон",
      "items": [
        {"name": "Мука", "key": "мука", "qty": 25, "unit": "г"},
        {"name": "Молоко", "key": "молоко", "qty": 125, "unit": "г"}
      ]
    },
    {
      "group": "Тесто",
      "items": [
        {"name": "Мука", "key": "мука", "qty": 375, "unit": "г"},
        {"name": "Молоко", "key": "молоко", "qty": 100, "unit": "г"},
        {"name": "Яйцо", "note": "55–60 г", "key": "яйцо", "qty": 1, "unit": "шт."},
        {"name": "Желток", "key": "яйцо", "qty": 1, "unit": "шт."},
        {"name": "Сахар", "key": "сахар", "qty": 60, "unit": "г"},
        {"name": "Соль", "key": "соль", "qty": 6, "unit": "г"},
        {"name": "Сливочное масло", "key": "сливочное масло", "qty": 70, "unit": "г"},
        {"name": "Сухие дрожжи", "key": "дрожжи", "qty": 7, "unit": "г"},
        {"name": "Танчжон", "key": null, "amount": "весь"}
      ]
    },
    {
      "group": "Начинка",
      "items": [
        {"name": "Изюм", "note": "можно предварительно замочить в горячей воде на 10 минут", "key": "изюм", "qty": 120, "unit": "г"}
      ]
    },
    {
      "group": "Для смазывания",
      "items": [
        {"name": "Яичный желток", "key": "яйцо", "qty": 1, "unit": "шт."},
        {"name": "Молоко", "key": "молоко", "qty": 1, "unit": "ст. л."}
      ]
    }
  ],
  "steps": [
    {"title": "Танчжон", "text": "В сотейнике смешать муку и молоко. Постоянно помешивая, варить на среднем огне до густой гладкой массы как крем. Остудить до комнатной температуры."},
    {"title": "Тесто", "text": "В миске соединить муку, сахар, соль, дрожжи. Добавить молоко, яйцо, желток и весь танчжон. Замесить тесто 7–10 минут. Постепенно добавить мягкое сливочное масло и вымешивать ещё 8–10 минут до гладкого, мягкого и эластичного теста."},
    {"title": "Первая расстойка", "text": "Накрыть тесто и оставить в тёплом месте на 1–1,5 часа, пока оно не увеличится в 2 раза."},
    {"title": "Начинка", "text": "Изюм при желании залить горячей водой на 10 минут, обсушить."},
    {"title": "Формовка", "text": "Тесто раскатать в прямоугольник примерно 35×40 см. Равномерно распределить изюм. Свернуть в плотный рулет по длинной стороне (40 см) и нарезать на 12 частей (по 3–4 см). Выложить булочки в форму (примерно 20×30 см), оставляя небольшие промежутки."},
    {"title": "Вторая расстойка", "text": "Накрыть и оставить на 40–60 минут, пока булочки не увеличатся в объёме."},
    {"title": "Выпечка", "text": "Смазать желтком с молоком. Выпекать при 180 °C 20–25 минут до золотистой корочки."}
  ],
  "tips": [
    "Изюм можно заменить клюквой, вяленой вишней или добавить немного апельсиновой цедры.",
    "Булочки вкусны и тёплыми, и полностью остывшими.",
    "Хранить в закрытом контейнере до 3 дней. Можно заморозить."
  ],
  "card": {
    "image": "cards/bulochki-s-izyumom.jpg",
    "theme": "green",
    "sticker": "Пышные, как облачко!",
    "aside": "Можно добавить немного корицы"
  },
  "photo": "photos/bulochki-s-izyumom.jpg",
  "author": "Юля",
  "added": "2026-10-15"
}
