{
  "id": "zharenyy-ris-s-krevetkami",
  "title": "Жареный рис с креветками",
  "description": "Ароматный жареный рис с креветками, беконом и имбирём. Быстрое и очень вкусное блюдо с азиатским настроением. Идеально на ужин.",
  "category": "goryachee",
  "tags": ["азиатское", "морепродукты"],
  "servings": {"qty": [3, 4], "unit": "порции"},
  "time": {"text": "~30 минут", "minutes": 30},
  "ingredients": [
    {
      "group": null,
      "items": [
        {"name": "Креветки", "key": "креветки", "qty": 500, "unit": "г"},
        {"name": "Бекон / колбаски", "key": "бекон", "qty": 100, "unit": "г"},
        {"name": "Рис жасмин", "key": "рис", "qty": 1, "unit": "стакан"},
        {"name": "Яйца", "key": "яйцо", "qty": 2, "unit": "шт."},
        {"name": "Имбирь", "key": "имбирь", "qty": 0.5, "unit": "ч. л."},
        {"name": "Соевый соус", "key": "соевый соус", "qty": 2, "unit": "ст. л."},
        {"name": "Рисовый уксус", "key": "уксус", "qty": 1, "unit": "ст. л."},
        {"name": "Оливковое масло", "key": "оливковое масло", "qty": 1, "unit": "ст. л."},
        {"name": "Зелёный лук", "key": "зелёный лук", "amount": "по вкусу"},
        {"name": "Соль", "key": "соль", "amount": "по вкусу"}
      ]
    }
  ],
  "steps": [
    {"text": "Отварить рис в пропорции 1:1,2 до готовности, остудить."},
    {"text": "Яйца взбить и пожарить тонким блином на сковороде с небольшим количеством масла. Свернуть рулетом и нарезать соломкой."},
    {"text": "Креветки очистить. На сковороде разогреть масло, обжарить креветки с имбирём 2–3 минуты."},
    {"text": "Добавить бекон (нарезанный полосками или кусочками) и обжаривать ещё 1–2 минуты."},
    {"text": "Всыпать рис и тщательно перемешать."},
    {"text": "Влить соевый соус и рисовый уксус."},
    {"text": "Добавить яичную соломку и снова перемешать."},
    {"text": "Попробовать, при необходимости посолить."},
    {"text": "Снять с огня и подать, посыпав зелёным луком."}
  ],
  "tips": [],
  "notes": [
    {
      "title": "Заметки",
      "items": [
        "Лучше использовать вчерашний рис.",
        "Лайм вместо уксуса — ещё вкуснее.",
        "Можно добавить чеснок по желанию."
      ]
    }
  ],
  "card": {"image": "cards/zharenyy-ris-s-krevetkami.jpg", "theme": "terracotta"},
  "photo": "photos/zharenyy-ris-s-krevetkami.jpg",
  "author": "Юля",
  "added": "2026-10-16"
}
