{
  "id": "chili-kon-karne",
  "title": "Чили кон карне",
  "description": "Невероятно вкусное и лёгкое в приготовлении блюдо!",
  "category": "goryachee",
  "tags": ["с мясом", "острое"],
  "servings": {"qty": 6, "unit": "порций"},
  "time": {"text": "~1,5 часа", "minutes": 90},
  "ingredients": [
    {
      "group": null,
      "items": [
        {"name": "Говяжий фарш", "key": "фарш", "qty": 500, "unit": "г"},
        {"name": "Фасоль красная консервированная", "key": "фасоль", "qty": 400, "unit": "г"},
        {"name": "Лук", "key": "лук", "qty": 1, "unit": "шт."},
        {"name": "Чеснок", "key": "чеснок", "qty": 4, "unit": "зубчик"},
        {"name": "Сладкий перец", "key": "болгарский перец", "qty": 1, "unit": "шт."},
        {"name": "Чили", "key": "острый перец", "qty": 0.5, "unit": "шт."},
        {"name": "Томаты в с/соку", "key": "помидоры", "qty": 400, "unit": "г"},
        {"name": "Вода", "key": "вода", "qty": 100, "unit": "мл"},
        {"name": "Соль", "key": "соль", "amount": "по вкусу"},
        {"name": "Сахар", "key": "сахар", "qty": 1, "unit": "ч. л."},
        {"name": "Сок лайма", "key": "лайм", "qty": 0.5, "unit": "шт."}
      ]
    },
    {
      "group": "Специи",
      "items": [
        {"name": "Зира", "key": "зира", "qty": 0.5, "unit": "ч. л."},
        {"name": "Орегано", "key": "орегано", "qty": 0.5, "unit": "ч. л."},
        {"name": "Кориандр", "key": "кориандр", "qty": 0.5, "unit": "ч. л."},
        {"name": "Чили молотый", "key": "острый перец", "qty": 0.25, "unit": "ч. л."}
      ]
    }
  ],
  "steps": [
    {"text": "Лук и чеснок мелко рубим. Обжариваем сначала лук до золотистого цвета, затем добавляем чеснок и зиру."},
    {"text": "Через пару минут добавляем фарш и обжариваем всё вместе."},
    {"text": "Когда фарш поменяет цвет, кладём сладкий и чили перец, обжариваем пару минут и добавляем кориандр, чили и орегано."},
    {"text": "Выкладываем томаты в собственном соку, перемешиваем и вливаем воду."},
    {"text": "Пробуем блюдо на вкус, приправляем солью, сахаром и соком лайма."},
    {"text": "Накрываем сотейник крышкой и тушим блюдо на небольшой мощности 1,5 часа. Это нужно, чтобы фарш достиг максимальной мягкости, овощи нужной консистенции и блюдо получилось нежным и тающим во рту."},
    {"text": "Консистенция блюда должна получиться густой, как у соуса болоньезе."},
    {"text": "В самом конце добавляем консервированную фасоль без сока, тушим всё вместе ещё 10–15 минут и снимаем с плиты."},
    {"text": "Подаём чили кон карне с гарниром, а также с ломтиками поджаренной в духовке тортильи."}
  ],
  "tips": [
    "Если у вас получается жиже, то ближе к концу потушите блюдо с открытой крышкой. Если гуще, то добавьте немного воды. Если не любите острое, добавьте меньше острого перца."
  ],
  "card": {"image": "cards/chili-kon-karne.jpg", "theme": "green", "footer": "Приятного аппетита!"},
  "photo": "photos/chili-kon-karne.jpg",
  "author": "Юля",
  "added": "2026-10-16"
}
