{
  "id": "plov-na-kostre-ot-dashi",
  "title": "Плов на костре от Даши",
  "description": "Ароматный, рассыпчатый плов с дымком и нежным мясом. Готовится просто, а получается по-настоящему вкусно!",
  "category": "goryachee",
  "tags": ["с курицей", "на костре"],
  "time": {"text": "~20 минут подготовки + 40–50 минут приготовления", "minutes": 70},
  "ingredients": [
    {
      "group": "Пропорции на 1 пачку риса (казан 5 л)",
      "items": [
        {"name": "Рис", "key": "рис", "qty": 900, "unit": "г"},
        {"name": "Бёдра куриные", "key": "курица", "qty": 900, "unit": "г"},
        {"name": "Лук репчатый", "note": "больших", "key": "лук", "qty": 2, "unit": "шт."},
        {"name": "Морковь", "note": "больших", "key": "морковь", "qty": 2, "unit": "шт."},
        {"name": "Вода", "key": "вода", "qty": [1.2, 1.3], "unit": "л"},
        {"name": "Соль", "note": "с горкой", "key": "соль", "qty": 1, "unit": "ст. л."},
        {"name": "Чеснок", "key": "чеснок", "qty": 1, "unit": "головка"},
        {"name": "Масло растительное", "key": "растительное масло", "qty": [200, 300], "unit": "мл"},
        {"name": "Приправа для плова", "key": "приправа для плова", "amount": "по вкусу"}
      ]
    }
  ],
  "steps": [
    {"text": "Нагрейте масло. Добавьте лук, обжарьте до золотистого цвета."},
    {"text": "Добавьте мясо, обжарьте. Добавьте морковь, обжаривайте до мягкости."},
    {"text": "Влейте кипяток, добавьте соль и специи. Варите зирвак 20–30 минут при постоянном кипении."},
    {"text": "Хорошо промытый рис выкладываем в зирвак."},
    {"text": "Варите до практически полного выкипания воды."},
    {"text": "По желанию на рис положите головку чеснока."},
    {"text": "Накройте плов целлофановым пакетом и закройте крышкой на 30–40 минут без огня."}
  ],
  "tips": [
    "Готовый плов получается ещё вкуснее, если дать ему настояться под крышкой 30–40 минут без огня."
  ],
  "card": {"image": "cards/plov-na-kostre-ot-dashi.jpg", "theme": "green"},
  "photo": "photos/plov-na-kostre-ot-dashi.jpg",
  "author": "Юля",
  "added": "2026-10-16"
}
