{
  "id": "keks-s-chernoy-smorodinoy",
  "title": "Кекс с чёрной смородиной",
  "description": "Нежный, влажный кекс с кислинкой смородины и лёгкой лимонной глазурью. Идеально к чаю.",
  "category": "vypechka",
  "tags": ["сладкое", "к чаю"],
  "servings": {"qty": [6, 8], "unit": "порций"},
  "time": {"text": "~60 минут", "minutes": 60},
  "equipment": "Духовка 180 °C",
  "ingredients": [
    {
      "group": null,
      "items": [
        {"name": "Чёрная смородина", "key": "смородина", "qty": 170, "unit": "г"},
        {"name": "Сливочное масло", "key": "сливочное масло", "qty": 100, "unit": "г"},
        {"name": "Сахар", "key": "сахар", "qty": 150, "unit": "г"},
        {"name": "Яйцо", "key": "яйцо", "qty": 1, "unit": "шт."},
        {"name": "Молоко тёплое", "key": "молоко", "qty": 150, "unit": "мл"},
        {"name": "Мука", "note": "+ 1 ст. л. для ягод", "key": "мука", "qty": 200, "unit": "г"},
        {"name": "Разрыхлитель", "key": "разрыхлитель", "qty": 2, "unit": "ч. л."}
      ]
    },
    {
      "group": "Глазурь",
      "items": [
        {"name": "Сахарная пудра", "key": "сахарная пудра", "qty": 80, "unit": "г"},
        {"name": "Сок лимона", "key": "лимон", "qty": 2, "unit": "ст. л."},
        {"name": "Вода", "key": "вода", "qty": 1, "unit": "ст. л."}
      ]
    }
  ],
  "steps": [
    {"text": "Сливочное масло комнатной температуры взбить с сахаром до пышной массы."},
    {"text": "Добавить яйцо и перемешать. Влить тёплое молоко, перемешать."},
    {"text": "Всыпать муку и разрыхлитель, замесить однородное тесто лопаткой."},
    {"text": "Чёрную смородину промыть и обсушить бумажным полотенцем."},
    {"text": "Смешать смородину с 1 ст. л. муки."},
    {"text": "Добавить ягоды в тесто и аккуратно перемешать, чтобы они равномерно распределились."},
    {"text": "Выложить тесто в форму (силиконовую, металлическую или керамическую)."},
    {"text": "Выпекать в разогретой духовке при 180 °C 40–50 минут. Готовность проверить деревянной шпажкой."},
    {"text": "Для глазури смешать сахарную пудру, лимонный сок и воду до однородности."},
    {"text": "Полить остывший кекс глазурью. Дать застыть и можно подавать!"}
  ],
  "tips": [],
  "notes": [
    {
      "title": "Заметки",
      "items": [
        "Можно использовать замороженную смородину.",
        "Без глазури — легче по калориям.",
        "Больше ягод — сочнее кекс!",
        "Хранить в контейнере до 3 дней."
      ]
    }
  ],
  "card": {"image": "cards/keks-s-chernoy-smorodinoy.jpg", "theme": "terracotta"},
  "photo": "photos/keks-s-chernoy-smorodinoy.jpg",
  "author": "Юля",
  "added": "2026-10-16"
}
