{
  "id": "sendvich-s-arahisovoy-pastoy-varenem-i-bananom",
  "title": "Сэндвич с арахисовой пастой, вареньем из чёрной смородины и бананом",
  "description": "Нежный сладкий сэндвич с контрастом вкусов — солоноватая арахисовая паста, кислинка смородины и мягкий банан. Идеален на быстрый завтрак или перекус.",
  "category": "zavtraki",
  "tags": ["быстро", "сладкое", "с собой"],
  "servings": {"qty": 1, "unit": "порция"},
  "time": {"text": "~5–7 минут", "minutes": [5, 7]},
  "ingredients": [
    {
      "group": null,
      "items": [
        {"name": "Хлеб тостовый", "key": "хлеб", "qty": 2, "unit": "ломтика"},
        {"name": "Арахисовая паста", "key": "арахисовая паста", "qty": [1, 2], "unit": "ст. л."},
        {"name": "Варенье из чёрной смородины", "key": "варенье", "qty": [1, 2], "unit": "ст. л."},
        {"name": "Банан", "key": "банан", "qty": 1, "unit": "шт."}
      ]
    }
  ],
  "steps": [
    {"text": "Поджарить хлеб на сухой сковороде или гриле до румяной корочки."},
    {"text": "Один ломтик намазать арахисовой пастой, второй — вареньем."},
    {"text": "Банан нарезать кружочками."},
    {"text": "Выложить банан на ломтик с арахисовой пастой."},
    {"text": "Накрыть вторым ломтиком (намазкой вниз)."}
  ],
  "tips": [
    "Можно слегка прижать сэндвич на сковороде — начинка станет мягче, а вкус ещё насыщеннее."
  ],
  "card": {"image": "cards/sendvich-s-arahisovoy-pastoy-varenem-i-bananom.jpg", "theme": "plum"},
  "photo": "photos/sendvich-s-arahisovoy-pastoy-varenem-i-bananom.jpg",
  "author": "Юля",
  "added": "2026-10-16"
}
