{
  "id": "syrnye-vafli",
  "title": "Сырные вафли",
  "description": "Ароматные, хрустящие снаружи и мягкие внутри. Отлично подходят для завтрака, перекуса или вместо хлеба!",
  "category": "zavtraki",
  "tags": ["с сыром", "быстро"],
  "time": {"text": "~10 минут подготовки + 15 минут выпечки", "minutes": 25},
  "equipment": "Вафельница",
  "ingredients": [
    {
      "group": null,
      "items": [
        {"name": "Яйцо", "key": "яйцо", "qty": 1, "unit": "шт."},
        {"name": "Творог", "key": "творог", "qty": 100, "unit": "г"},
        {"name": "Кефир или ряженка", "key": "кефир", "qty": 100, "unit": "г"},
        {"name": "Сыр твёрдый", "key": "сыр", "qty": 100, "unit": "г"},
        {"name": "Мука", "key": "мука", "qty": 125, "unit": "г"},
        {"name": "Сливочное масло", "note": "растопить", "key": "сливочное масло", "qty": 20, "unit": "г"},
        {"name": "Соль, паприка и мускатный орех", "key": "соль", "amount": "по вкусу"},
        {"name": "Разрыхлитель", "key": "разрыхлитель", "qty": 1, "unit": "ч. л.", "optional": true}
      ]
    }
  ],
  "steps": [
    {"text": "В глубокой миске вилкой разомните творог до однородности."},
    {"text": "Добавьте яйцо, кефир, растопленное сливочное масло и хорошо перемешайте."},
    {"text": "Добавьте натёртый на крупной тёрке сыр, соль, паприку и мускатный орех. Перемешайте."},
    {"text": "Просейте муку, добавьте разрыхлитель (если используете) и постепенно всыпьте в массу, перемешивая ложкой или венчиком."},
    {"text": "Тесто должно получиться густым, как сметана."},
    {"text": "Разогрейте вафельницу и слегка смажьте её маслом."},
    {"text": "Выложите тесто порциями и выпекайте вафли до золотистой корочки (около 4–6 минут)."},
    {"text": "Готовые вафли выложите на решётку, чтобы они не стали мягкими."},
    {"text": "Подавайте тёплыми со сметаной, зеленью или любимым соусом."}
  ],
  "tips": [
    "Для более яркого вкуса используйте смесь сыров (например, чеддер + пармезан). Можно добавить зелень или чесночный порошок. Вафли вкусны как в тёплом, так и в холодном виде!"
  ],
  "notes": [
    {
      "title": "Идеи подачи",
      "items": [
        "Со сметаной и зеленью.",
        "С овощами и зеленью.",
        "С чесночным соусом или йогуртовым дипом."
      ]
    }
  ],
  "card": {"image": "cards/syrnye-vafli.jpg", "theme": "green"},
  "photo": "photos/syrnye-vafli.jpg",
  "author": "Юля",
  "added": "2026-10-16"
}
